{
  "name": "basic-eval-suite",
  "description": "Demonstrates the core eval check types for CLI and file testing.",
  "version": "1.0.0",
  "output_dir": "./eval_results",
  "snapshot_dir": "./snapshots",
  "stop_on_failure": false,
  "tests": [
    {
      "name": "echo command succeeds",
      "description": "Verify a basic shell command exits cleanly.",
      "check": "command_succeeds",
      "params": {
        "command": "echo 'Hello from Kujo Eval'"
      }
    },
    {
      "name": "echo output contains greeting",
      "description": "Verify command output contains expected text.",
      "check": "output_contains",
      "params": {
        "command": "echo 'Hello from Kujo Eval'",
        "expected": "Hello"
      }
    },
    {
      "name": "echo output does not contain error",
      "description": "Verify command output does NOT contain error text.",
      "check": "output_does_not_contain",
      "params": {
        "command": "echo 'Everything is fine'",
        "expected": "ERROR"
      }
    },
    {
      "name": "eval.json file exists",
      "description": "Verify the eval config file exists on disk.",
      "check": "file_exists",
      "params": {
        "path": "eval.json"
      }
    },
    {
      "name": "temp file does not exist",
      "description": "Verify a non-existent file is reported as missing.",
      "check": "file_does_not_exist",
      "params": {
        "path": "./nonexistent_temp_file_xyz.txt"
      }
    },
    {
      "name": "kennel.toml contains package name",
      "description": "Verify a file contains expected text.",
      "check": "file_contains",
      "params": {
        "path": "kennel.toml",
        "expected": "eval"
      }
    },
    {
      "name": "kennel.toml does not contain forbidden text",
      "description": "Verify a file does NOT contain unexpected text.",
      "check": "file_does_not_contain",
      "params": {
        "path": "kennel.toml",
        "expected": "FORBIDDEN_TEXT_XYZ_123"
      }
    },
    {
      "name": "JSON shape validation passes",
      "description": "Verify a JSON file has expected keys.",
      "check": "json_matches_shape",
      "params": {
        "path": "kennel.toml",
        "required_keys": ["package"]
      }
    },
    {
      "name": "exit code is 0 for echo",
      "description": "Verify a command exits with a specific code.",
      "check": "exit_code_equals",
      "params": {
        "command": "echo ok",
        "expected": 0
      }
    },
    {
      "name": "deliberate failure example",
      "description": "This test intentionally fails to show failure reporting.",
      "check": "command_fails",
      "params": {
        "command": "echo 'this succeeds, so the check fails'"
      }
    }
  ]
}
