{"name":"policy-explain-fixture-suite","policy_profile":"local-dev","policy_stage_overlays":{"release":{"require_command_policy":true,"path_policy_mode":"allowlist-required","allowed_commands":["echo"],"blocked_arg_patterns":["rm -rf"],"allowed_paths":["./tests"],"allowed_http_hosts":["example.com"],"blocked_http_hosts":["blocked.example.com"],"redaction_audit_mode":true}},"tests":[{"name":"ok","check":"command_succeeds","params":{"command":"echo ok"}}]}